exp	job	val_bpb	status	description
0	j001,j003	3.3975	keep	baseline (CausalMLP ctx8, SGD lr1e-2 mom0.9)
1	j004,j005	2.4266	keep	AdamW lr3e-3 wd0.01 instead of SGD
2	j006,j008	2.4532	discard	CONTEXT 8->16 (j007 NODE_FAIL resubmitted as j008)
3	j009,j010	2.5188	discard	cosine LR decay to 0 over time budget (peak 3e-3)
4	j011,j012	2.4123	keep	AdamW LR 3e-3 -> 1e-2 (constant)
