exp	job	val_bpb	status	description
0	j001,j003	3.5117	keep	baseline: CausalMLP ctx8, SGD lr1e-2 mom0.9
1	j004,j005	2.4760	keep	AdamW lr3e-3 betas(0.9,0.99) wd0.01
2	j006,j008	2.5923	discard	warmup 20 + cosine LR decay 3e-3 to 3e-4
3	j009,j010	2.4366	keep	AdamW lr1e-2 (higher LR beats exp1)
4	j011,j012	2.5197	discard	context 8 -> 16 bytes hurts performance
