exp	job	val_bpb	status	description
0	j001,j003	3.3601	keep	baseline (unmodified; j002 NODE_FAIL resubmitted as j003)
1	j004,j005	2.4299	keep	AdamW lr=3e-3 wd=0.01 instead of SGD momentum
2	j006,j008	2.4695	discard	CONTEXT 8->16 (fewer steps; j007 NODE_FAIL resubmitted as j008)
3	j009,j010	2.5152	discard	warmup 5% + linear LR decay to 0 (time-based)
4	j011,j012	2.4152	keep	AdamW LR 3e-3 -> 1e-2 (constant)
